{
  "schemaVersion": "v1-mvp-content-quality.gold-notes.1",
  "pageId": "domestic-portal-qq-news-home",
  "url": "https://news.qq.com/",
  "reviewStatus": "semi_auto_accepted",
  "reviewedAt": "2026-07-02T20:54:02.767Z",
  "expectedMainClaims": [
    {
      "id": "claim-1",
      "text": "新闻标题",
      "mustAppear": true
    },
    {
      "id": "claim-2",
      "text": "推荐新闻",
      "mustAppear": false
    },
    {
      "id": "claim-3",
      "text": "频道列表",
      "mustAppear": false
    }
  ],
  "expectedMindmapThemes": [
    {
      "id": "theme-1",
      "text": "新闻标题",
      "mustAppear": true
    },
    {
      "id": "theme-2",
      "text": "推荐新闻",
      "mustAppear": true
    },
    {
      "id": "theme-3",
      "text": "频道列表",
      "mustAppear": false
    }
  ],
  "prohibitedNoiseThemes": [
    {
      "id": "noise-1",
      "text": "首页",
      "mustAppear": false
    },
    {
      "id": "noise-2",
      "text": "登录",
      "mustAppear": false
    },
    {
      "id": "noise-3",
      "text": "广告",
      "mustAppear": false
    },
    {
      "id": "noise-4",
      "text": "推荐",
      "mustAppear": false
    },
    {
      "id": "noise-5",
      "text": "评论",
      "mustAppear": false
    },
    {
      "id": "noise-6",
      "text": "版权",
      "mustAppear": false
    }
  ],
  "requiredEvidenceTargets": [
    {
      "targetId": "evidence-1",
      "description": "article_title",
      "acceptableEvidenceTypes": [
        "body_text",
        "lead",
        "metadata",
        "fallback_text"
      ]
    },
    {
      "targetId": "evidence-2",
      "description": "article_body",
      "acceptableEvidenceTypes": [
        "body_text",
        "lead",
        "metadata",
        "fallback_text"
      ]
    },
    {
      "targetId": "evidence-3",
      "description": "中国新闻周刊 27分钟前 热点精选 专题英格兰vs民主刚果： 凯恩",
      "acceptableEvidenceTypes": [
        "body_text",
        "lead",
        "metadata",
        "fallback_text"
      ]
    }
  ],
  "lowSignalPolicy": {
    "mayPassWhenOnlyTitleAvailable": false,
    "degradedReasonRequired": true
  },
  "finalStrictEligible": true,
  "notes": "CQ 自动化 strict gold note。人工复核前不得升级为 full V1 complete；本文件用于防止标题、导航、推荐、评论或站点壳冒充正文理解。"
}