{
  "schemaVersion": "v1-mvp-content-quality.gold-notes.1",
  "pageId": "international-doc-github-blog",
  "url": "https://github.blog/",
  "reviewStatus": "semi_auto_accepted",
  "reviewedAt": "2026-07-03T05:25:24.068Z",
  "expectedMainClaims": [
    {
      "id": "claim-1",
      "text": "blog post title",
      "mustAppear": true
    },
    {
      "id": "claim-2",
      "text": "summary",
      "mustAppear": false
    },
    {
      "id": "claim-3",
      "text": "topic",
      "mustAppear": false
    }
  ],
  "expectedMindmapThemes": [
    {
      "id": "theme-1",
      "text": "blog post title",
      "mustAppear": true
    },
    {
      "id": "theme-2",
      "text": "summary",
      "mustAppear": true
    },
    {
      "id": "theme-3",
      "text": "topic",
      "mustAppear": false
    }
  ],
  "prohibitedNoiseThemes": [
    {
      "id": "noise-1",
      "text": "首页",
      "mustAppear": false
    },
    {
      "id": "noise-2",
      "text": "登录",
      "mustAppear": false
    },
    {
      "id": "noise-3",
      "text": "广告",
      "mustAppear": false
    },
    {
      "id": "noise-4",
      "text": "推荐",
      "mustAppear": false
    },
    {
      "id": "noise-5",
      "text": "评论",
      "mustAppear": false
    },
    {
      "id": "noise-6",
      "text": "版权",
      "mustAppear": false
    }
  ],
  "requiredEvidenceTargets": [
    {
      "targetId": "evidence-1",
      "description": "article_meta",
      "acceptableEvidenceTypes": [
        "body_text",
        "lead",
        "metadata",
        "fallback_text"
      ]
    },
    {
      "targetId": "evidence-2",
      "description": "Arthur Searle June 26, 2026 AI",
      "acceptableEvidenceTypes": [
        "body_text",
        "lead",
        "metadata",
        "fallback_text"
      ]
    },
    {
      "targetId": "evidence-3",
      "description": "来源与追踪",
      "acceptableEvidenceTypes": [
        "body_text",
        "lead",
        "metadata",
        "fallback_text"
      ]
    }
  ],
  "lowSignalPolicy": {
    "mayPassWhenOnlyTitleAvailable": false,
    "degradedReasonRequired": true
  },
  "finalStrictEligible": true,
  "notes": "CQ 自动化 strict gold note。人工复核前不得升级为 full V1 complete；本文件用于防止标题、导航、推荐、评论或站点壳冒充正文理解。"
}